{
  "schema_version": "3.0.0",
  "skeleton_id": "crawler_alien_tripod_compact_v3",
  "family": "crawler",
  "locomotion_hint": "crawl",
  "status": "draft",
  "symmetry_pct": 92,
  "branches": [
    {
      "branch_id": "core",
      "template": "core1",
      "parent_branch": null,
      "attach_bone_index": 0,
      "origin_m": [
        0,
        0.6323,
        -0.2646
      ],
      "direction": [
        0,
        0,
        1
      ],
      "up": [
        0,
        1,
        0
      ],
      "length_m": 0.5293,
      "girth_m": 0.1588,
      "size_class": "L",
      "side": "C",
      "required": true,
      "accepts": {
        "categories": [
          "core"
        ],
        "templates": [
          "core1"
        ]
      },
      "connector_size_class": null,
      "binding_profile_id": "core1_body",
      "binding_profile_version": "1.0.0",
      "socket": {
        "parent_joint": "root",
        "position_m": [
          0,
          0.6323,
          -0.2646
        ],
        "rotation_xyzw": [
          0.0,
          0.0,
          0.0,
          1.0
        ]
      },
      "gait": {
        "role": "core",
        "phase_rad": 0.0,
        "support_phase": 0.5,
        "bend_pole_m": [
          0,
          0.8323,
          -0.5146
        ],
        "stride_m": 0.2223,
        "clearance_m": 0.0635,
        "cadence_hz": 0.0
      },
      "stance_deg": [
        0.0
      ],
      "stance_z_deg": [
        0.0
      ]
    },
    {
      "branch_id": "leg_0",
      "template": "insect_leg4",
      "parent_branch": "core",
      "attach_bone_index": 0,
      "origin_m": [
        0.3054,
        0.6323,
        0.0
      ],
      "direction": [
        1.0,
        0.0,
        0.0
      ],
      "up": [
        0,
        1,
        0
      ],
      "length_m": 0.9772,
      "girth_m": 0.1466,
      "size_class": "M",
      "side": "C",
      "required": true,
      "accepts": {
        "categories": [
          "limb"
        ],
        "templates": [
          "insect_leg4"
        ]
      },
      "connector_size_class": "M",
      "binding_profile_id": "insect_leg4_articulated",
      "binding_profile_version": "1.0.0",
      "socket": {
        "parent_joint": "upper",
        "position_m": [
          0.3054,
          0.0,
          0.2646
        ],
        "rotation_xyzw": [
          0.0,
          0.70710678,
          0.0,
          0.70710678
        ]
      },
      "gait": {
        "role": "locomotor",
        "phase_rad": 0.0,
        "support_phase": 0.62,
        "bend_pole_m": [
          0.3054,
          0.8323,
          -0.25
        ],
        "stride_m": 0.4104,
        "clearance_m": 0.1173,
        "cadence_hz": 1.5
      },
      "stance_deg": [
        45.028,
        -60.037,
        -70.044,
        10.006
      ],
      "stance_z_deg": [
        0.0,
        0.0,
        0.0,
        0.0
      ],
      "contacts": [
        {
          "kind": "foot",
          "bone_index": 3,
          "local_point_m": [
            0.0,
            0.0977,
            0.0
          ]
        }
      ]
    },
    {
      "branch_id": "leg_1",
      "template": "insect_leg4",
      "parent_branch": "core",
      "attach_bone_index": 0,
      "origin_m": [
        -0.1527,
        0.6323,
        -0.1473
      ],
      "direction": [
        -0.5,
        0.0,
        -0.866025
      ],
      "up": [
        0,
        1,
        0
      ],
      "length_m": 0.9772,
      "girth_m": 0.1466,
      "size_class": "M",
      "side": "C",
      "required": true,
      "accepts": {
        "categories": [
          "limb"
        ],
        "templates": [
          "insect_leg4"
        ]
      },
      "connector_size_class": "M",
      "binding_profile_id": "insect_leg4_articulated",
      "binding_profile_version": "1.0.0",
      "socket": {
        "parent_joint": "upper",
        "position_m": [
          -0.1527,
          0.0,
          0.1173
        ],
        "rotation_xyzw": [
          0.0,
          -0.9659258,
          0.0,
          0.25881914
        ]
      },
      "gait": {
        "role": "locomotor",
        "phase_rad": 2.094395,
        "support_phase": 0.62,
        "bend_pole_m": [
          -0.1527,
          0.8323,
          -0.3973
        ],
        "stride_m": 0.4104,
        "clearance_m": 0.1173,
        "cadence_hz": 1.5
      },
      "stance_deg": [
        45.028,
        -60.037,
        -70.044,
        10.006
      ],
      "stance_z_deg": [
        0.0,
        0.0,
        0.0,
        0.0
      ],
      "contacts": [
        {
          "kind": "foot",
          "bone_index": 3,
          "local_point_m": [
            0.0,
            0.0977,
            0.0
          ]
        }
      ]
    },
    {
      "branch_id": "leg_2",
      "template": "insect_leg4",
      "parent_branch": "core",
      "attach_bone_index": 0,
      "origin_m": [
        -0.1527,
        0.6323,
        0.1473
      ],
      "direction": [
        -0.5,
        0.0,
        0.866025
      ],
      "up": [
        0,
        1,
        0
      ],
      "length_m": 0.9772,
      "girth_m": 0.1466,
      "size_class": "M",
      "side": "C",
      "required": true,
      "accepts": {
        "categories": [
          "limb"
        ],
        "templates": [
          "insect_leg4"
        ]
      },
      "connector_size_class": "M",
      "binding_profile_id": "insect_leg4_articulated",
      "binding_profile_version": "1.0.0",
      "socket": {
        "parent_joint": "upper",
        "position_m": [
          -0.1527,
          0.0,
          0.4119
        ],
        "rotation_xyzw": [
          0.0,
          -0.25881914,
          0.0,
          0.9659258
        ]
      },
      "gait": {
        "role": "locomotor",
        "phase_rad": 4.18879,
        "support_phase": 0.62,
        "bend_pole_m": [
          -0.1527,
          0.8323,
          -0.1027
        ],
        "stride_m": 0.4104,
        "clearance_m": 0.1173,
        "cadence_hz": 1.5
      },
      "stance_deg": [
        45.028,
        -60.037,
        -70.044,
        10.006
      ],
      "stance_z_deg": [
        0.0,
        0.0,
        0.0,
        0.0
      ],
      "contacts": [
        {
          "kind": "foot",
          "bone_index": 3,
          "local_point_m": [
            0.0,
            0.0977,
            0.0
          ]
        }
      ]
    }
  ],
  "neutral_pose": {
    "root_offset_m": [
      0.0,
      -0.2394,
      0.0
    ],
    "rotations": [
      {
        "bone_name": "root",
        "rotation_xyzw": [
          0.0,
          0.0,
          0.0,
          1.0
        ]
      },
      {
        "bone_name": "core_b0",
        "rotation_xyzw": [
          0.0,
          0.0,
          0.0,
          1.0
        ]
      },
      {
        "bone_name": "leg_0_b0",
        "rotation_xyzw": [
          0.38290917,
          0.0,
          0.0,
          0.923786
        ]
      },
      {
        "bone_name": "leg_0_b1",
        "rotation_xyzw": [
          -0.5002796,
          0.0,
          0.0,
          0.86586392
        ]
      },
      {
        "bone_name": "leg_0_b2",
        "rotation_xyzw": [
          -0.57389093,
          0.0,
          0.0,
          0.81893175
        ]
      },
      {
        "bone_name": "leg_0_b3",
        "rotation_xyzw": [
          0.0872079,
          0.0,
          0.0,
          0.99619013
        ]
      },
      {
        "bone_name": "leg_1_b0",
        "rotation_xyzw": [
          0.38290917,
          0.0,
          0.0,
          0.923786
        ]
      },
      {
        "bone_name": "leg_1_b1",
        "rotation_xyzw": [
          -0.5002796,
          0.0,
          0.0,
          0.86586392
        ]
      },
      {
        "bone_name": "leg_1_b2",
        "rotation_xyzw": [
          -0.57389093,
          0.0,
          0.0,
          0.81893175
        ]
      },
      {
        "bone_name": "leg_1_b3",
        "rotation_xyzw": [
          0.0872079,
          0.0,
          0.0,
          0.99619013
        ]
      },
      {
        "bone_name": "leg_2_b0",
        "rotation_xyzw": [
          0.38290917,
          0.0,
          0.0,
          0.923786
        ]
      },
      {
        "bone_name": "leg_2_b1",
        "rotation_xyzw": [
          -0.5002796,
          0.0,
          0.0,
          0.86586392
        ]
      },
      {
        "bone_name": "leg_2_b2",
        "rotation_xyzw": [
          -0.57389093,
          0.0,
          0.0,
          0.81893175
        ]
      },
      {
        "bone_name": "leg_2_b3",
        "rotation_xyzw": [
          0.0872079,
          0.0,
          0.0,
          0.99619013
        ]
      }
    ]
  },
  "anatomy": {
    "archetype_id": "crawler_alien_tripod",
    "body_plan": "crawler",
    "style": "anatomical",
    "traits": {
      "min_support": 2,
      "body_on_ground": false,
      "ring": false,
      "pole_ik": false,
      "compact_clip": true
    },
    "support_branches": [
      "leg_0",
      "leg_1",
      "leg_2"
    ],
    "contact_branches": [
      "leg_0",
      "leg_1",
      "leg_2"
    ],
    "symmetry": {
      "kind": "radial",
      "ring_count": 3
    },
    "landmarks": {
      "pelvis": "core",
      "shoulder": "core",
      "neck": "core"
    },
    "silhouette": {
      "height_m": 0.6323,
      "length_m": 0.9451,
      "width_m": 1.3881
    },
    "budgets": {
      "bones": 14,
      "parts": 4,
      "triangles": 3070
    }
  },
  "provenance": {
    "generator": "cc-gen-3",
    "seed": 1,
    "preset": "compact"
  }
}
